,title
0,Scotland's Salmond launches rival pro-independence party - Reuters Africa
1,"Scottish leader Sturgeon found to have misled parliament, Sky reports - Reuters"
2,Scotland's future hangs in balance as report into leader's conduct awaited - Reuters.com
3,Scotland's future hangs in balance as report into leader's conduct awaited - Reuters Australia
4,SNP publishes 'reckless' bill for second independence referendum by end of 2023
5,Holyrood 2021: SNP's Sturgeon pledges to double child payment
6,Holyrood election 2021: The 'intense' battle for every vote in Scotland
7,How Scots and Catalans are looking to each other to ease their independence woes
8,"Politics latest news: Government only learned about vaccine shortage 'in last few days', minister admits"
9,Douglas Ross urges Unionists to 'rediscover Better Together spirit' from 2014 to stop SNP
10,Nicola Sturgeon only able to hand large pay rise to Scottish NHS staff 'thanks to Treasury billions'
11,"Scotland can’t move ‘too fast’ out of lockdown, Anas Sarwar warns, as latest figures show it has highest Covid rate in UK"
12,Can Labour's New Leader in Scotland Take Advantage of Disarray in SNP to Mount a Comeback?
13,Former SNP MP Kenny MacAskill Won’t Hold By-Election After Defecting to Alba Party
14,"Starmer: Time for recovery in Scotland, not a referendum"
15,Holyrood 2021: 'Time to end the scandal of child poverty'
16,Sturgeon Blasts Treating Politics ‘Like a Game' Amid Spate of Defections from SNP to Salmond’s Alba
17,SNP applies to put 'Indyref2' on Holyrood election ballot paper
18,Who’ll win the Airdrie and Shotts by-election?
19,Scottish Liberal Democrat election gains 'can stop SNP majority'
20,Tory Holyrood candidate under fire for 'offensive' comments on public sector pay and Covid
21,Links 3/27/2020
22,"UK PM to Reportedly Warn Against ‘Reckless’ 2nd Scottish Referendum, Mulls Covert Unionist Strategy"
23,Scottish Parliament election 2021: A really simple guide
24,Will Labour or the Conservatives win the battle for second place in the Scottish election?
25,What does Alex Salmond's new party mean for the election?
26,"Nicola Sturgeon won’t resign, but the Salmond scandal could yet be her downfall"
27,Special report: Sturgeon clings to tarnished crown after inquiries ‘lift lid on the sewer’ of SNP politics
28,"The Alex Salmond inquiry has failed to unsettle the SNP, but the vaccine roll-out might"
29,Tory MPs slam Nicola Sturgeon over NHS pay rise
30,Holyrood 2021: Labour pledges mental health staff for all GP clinics
31,Polling: Labour voters divided over whether Labour is the party of “the north” or “London”
32,2021 elections: A really simple guide
33,SNP to double Scottish child benefit top-up if re-elected
34,Sturgeon row: Scottish Health Secretary Jeane Freeman dismisses calls for FM to quit
35,Nicola Sturgeon faces fury over push for Scottish independence referendum THIS YEAR
36,"Fall in support for Scottish independence could be result of ‘vaccine bounce’, analysis suggests"
37,Boris Johnson news — live: PM ‘misled parliament’ over Covid contracts as strike fund launched over 1% NHS pay rise
38,"Politics latest news: Roadmap out of lockdown unchanged by EU export ban, says No 10"
39,"Scots turning against SNP plan for independence referendum, poll finds"
40,Nicola Sturgeon is ridiculed for her 'forgetfulness' as she offers a 'hard to believe' excuse
41,Nicola Sturgeon's 'litany of lies' is 'too much for her to survive'
42,"Referendum bill could see Scots vote on independence this year, SNP say"
43,Alba Party: Can Alex Salmond create a ‘super majority’ for Scottish independence?
44,Politics latest news: EU launches legal challenge against UK over 'unlawful' Gibraltar state aid
45,"Government repeatedly less strict on coronavirus than public wanted, poll finds"
46,"Politics latest news: David Frost 'playing games around Brexit', claims former mandarin"
47,Nicola Sturgeon faces fury over push for Scottish independence referendum THIS YEAR
48,How Scots and Catalans are looking to each other to ease their independence woes
49,"Trials, troubles and tribulations: Scots and Catalans look to each other to ease independence woes"
50,"SNP no longer set for Holyrood majority, new poll shows"
51,Tories warn of Salmond threat to pro-union parties in Scottish election
52,Scotland's future hangs in balance as report into leader's conduct awaited
